{
  "schema": "buildfix.report.v1",
  "tool": {
    "name": "buildfix",
    "version": "0.1.0"
  },
  "run": {
    "started_at": "2026-02-04T21:25:55.054109400+00:00",
    "ended_at": "2026-02-04T21:25:55.054128200+00:00",
    "duration_ms": 0
  },
  "verdict": {
    "status": "warn",
    "counts": {
      "info": 0,
      "warn": 1,
      "error": 0
    }
  },
  "findings": [],
  "data": {
    "files_touched": 1,
    "ops_blocked": 0,
    "ops_total": 1,
    "patch_bytes": 314
  }
}